[
    {"country": "Togo", "event": "Independence of Togo", "date": "1960-04-27", "category": "Politics", "wrap": false},
    {"country": "Benin", "event": "Independence of Benin", "date": "1960-08-01", "category": "Politics", "wrap": false},
    {"country": "Togo", "event": "Coup d'Etat Togo", "date": "1963-01-13", "category": "Politics"},
    {"country": "Togo", "event": "Gnassingbé Eyadéma seizes power", "date": "1967-04-15", "category": "Politics"},
    {"country": "Benin", "event": "Dahomean May", "date": "1969-05-01", "category": "Politics", "x": 0.46},
    {"country": "Benin", "event": "University of Dahomey founded", "date": "1970-08-21", "category": "Education", "wrap": false},
    {"country": "Togo", "event": "University of Benin founded", "date": "1970-09-14", "category": "Education", "wrap": false, "x": 0.60},
    {"country": "Benin", "event": "Emmaüs Community founded", "date": "1972-01-01", "category": "Religion"},
    {"country": "Togo", "event": "Youth associations banned", "date": "1972-02-12", "category": "Politics", "wrap": false, "x": 0.53},
    {"country": "Benin", "event": "Mathieu Kérékou seizes power", "date": "1972-10-26", "category": "Politics", "wrap": false},
    {"country": "Togo", "event": "Official inauguration of UB", "date": "1973-11-29", "category": "Education", "wrap": false, "x": 0.65},
    {"country": "Togo", "event": "UB Bible study group formed", "date": "1974-09-01", "category": "Religion"},
    {"country": "Benin", "event": "École Nouvelle reform", "date": "1975-06-01", "category": "Education", "label": "École Nouvelle\nreform", "x": 0.46},
    {"country": "Togo", "event": "École Nouvelle reform", "date": "1975-05-06", "category": "Education", "label": "École Nouvelle\nreform", "x": 0.54},
    {"country": "Benin", "event": "UDahomey renamed National University of Benin", "date": "1975-11-30", "category": "Education", "label": "UDahomey\nrenamed National\nUniversity of Benin"},
    {"country": "Togo", "event": "MONESTO founded", "date": "1977-08-01", "category": "Politics"},
    {"country": "Benin", "event": "GBEEB founded", "date": "1977-12-01", "category": "Religion", "x": 0.15},
    {"country": "Benin", "event": "CIUB officially recognised", "date": "1979-01-01", "category": "Religion", "wrap": false, "x": 0.45},
    {"country": "Togo", "event": "Ban of religious sects", "date": "1979-02-27", "category": "Religion", "wrap": false},
    {"country": "Benin", "event": "ILACI foundation stone laid", "date": "1979-10-06", "category": "Religion", "x": 0.20},
    {"country": "Togo", "event": "JEC-U founded", "date": "1981-01-01", "category": "Religion"},
    {"country": "Togo", "event": "GBUST officially recognised", "date": "1987-01-01", "category": "Religion", "wrap": false},
    {"country": "Togo", "event": "8th GBUAF Triennial Congress", "date": "1988-08-02", "category": "Religion", "wrap": false},
    {"country": "Benin", "event": "National Conference", "date": "1990-02-19", "category": "Politics"},
    {"country": "Togo", "event": "National Conference", "date": "1991-07-08", "category": "Politics"},
    {"country": "Togo", "event": "CCU construction begins", "date": "1996-01-01", "category": "Religion", "wrap": false},
    {"country": "Togo", "event": "RAJEC Togo founded", "date": "1998-01-01", "category": "Religion"},
    {"country": "Benin", "event": "AIMB founded", "date": "1999-01-01", "category": "Religion"},
    {"country": "Togo", "event": "University of Kara founded", "date": "1999-01-21", "category": "Education", "wrap": false},
    {"country": "Benin", "event": "UNB renamed University of Abomey-Calavi", "date": "2001-01-01", "category": "Education", "label": "UNB renamed\nUniversity of Abomey-Calavi"},
    {"country": "Togo", "event": "UB renamed University of Lomé", "date": "2001-03-09", "category": "Education", "wrap": false},
    {"country": "Benin", "event": "University of Parakou founded", "date": "2001-09-18", "category": "Education", "label": "University of\nParakou founded", "x": 0.46},
    {"country": "Togo", "event": "Death of Eyadéma", "date": "2005-02-05", "category": "Politics"},
    {"country": "Benin", "event": "RAJEC Benin founded", "date": "2005-08-01", "category": "Religion", "wrap": false},
    {"country": "Togo", "event": "ACMT founded", "date": "2006-08-01", "category": "Religion"},
    {"country": "Togo", "event": "LMD reform implemented", "date": "2008-07-21", "category": "Education"},
    {"country": "Benin", "event": "LMD reform implemented", "date": "2010-06-11", "category": "Education"}
]
